[
    {
        "abbreviations": {
            "Gatherer": "#C15",
            "askwizards-20040812": null,
            "Twitter": "#MTGC15"
        },
        "fetch": true,
        "name": "MTG-Commander 2015",
        "release_date": "2015-11-13"
    },
    {
        "abbreviations": {
            "Gatherer": "OGW",
            "askwizards-20040812": null,
            "Twitter": "#MTGOGW"
        },
        "fetch": true,
        "name": "Oath of the Gatewatch",
        "release_date": "2016-01-22"
    }
]
